{
  "contractVersion": "1.0",
  "receiptRef": "receipt.test.1",
  "executionRef": "execution.test.1",
  "status": "SUCCEEDED",
  "exitCode": 0,
  "stdout": {
    "text": "[1, 2, 3]",
    "truncated": false,
    "originalBytes": 9
  },
  "stderr": {
    "text": "",
    "truncated": false,
    "originalBytes": 0
  },
  "inputFingerprint": "dddddddddddddddddddddddddddddddddddddddddddddddddddddddddddddddd",
  "inputs": [
    {
      "path": "src/main/java/Sort.java",
      "sha256": "bbbbbbbbbbbbbbbbbbbbbbbbbbbbbbbbbbbbbbbbbbbbbbbbbbbbbbbbbbbbbbbb",
      "sizeBytes": 512
    }
  ],
  "startedAt": "2026-08-16T10:00:02Z",
  "finishedAt": "2026-08-16T10:00:05Z"
}
